{
  "interface_version": 1,
  "invocation": {
    "caller": "user",
    "harness": "claude-code",
    "mode": "direct",
    "session_id": "session-0001"
  },
  "plugin_version": "0.1.2",
  "reason": "build-v2 ended PARTIAL (not_complete): stop condition 3",
  "report_only": false,
  "run_dir": "/tmp/ship-v2/run-0001",
  "run_id": "run-0001",
  "station": "ship-v2",
  "station_result": {
    "build": "PARTIAL",
    "card": "not started",
    "chat": "SHIP: A \u2014 docs/plans/2026-09-20-widget.md\nHook: armed\nResult: STOPPED (condition 3: build-v2 stopped mid-slice)\nBuild: PARTIAL  \u00b7  Signoff: not reached  \u00b7  Recheck: not reached  \u00b7  Card: not started  \u00b7  Laps: 0\n\nBottom line: Slice A went through the loop. Read the block for what is next.\n",
    "condition": 3,
    "doc": "docs/plans/2026-09-20-widget.md",
    "events": [],
    "fixed": [],
    "hook": {
      "armed": true,
      "evidence": "session.jsonl line 41 (a system record)",
      "harness": "claude-code",
      "how": "a record of this session's own transcript shows the Stop hook's confirmation",
      "label": "armed"
    },
    "laps": {
      "allowed": 2,
      "opened": [],
      "owner_words": null,
      "taken": 0
    },
    "pauses": [],
    "recheck": "not reached",
    "remains": [],
    "result_line": "STOPPED (condition 3: build-v2 stopped mid-slice)",
    "signoff": "not reached",
    "slice": "A",
    "visits": [
      {
        "lap": 0,
        "run_dir": "/tmp/ship-v2/run-0001/visits/0-build-v2",
        "station": "build-v2",
        "status": "not_complete",
        "word": "PARTIAL"
      }
    ]
  },
  "status": "stopped",
  "stop_tag": "build-not-complete",
  "trace": {
    "lines": 4,
    "path": "/tmp/ship-v2/run-0001/trace.jsonl",
    "refused": 0,
    "visits": 2
  },
  "writes": [
    {
      "kind": "run_artifact",
      "path": "/tmp/ship-v2/run-0001/ship.json",
      "sha256_after": "3f3f3f3f3f3f3f3f3f3f3f3f3f3f3f3f3f3f3f3f3f3f3f3f3f3f3f3f3f3f3f3f",
      "sha256_before": null
    },
    {
      "kind": "run_artifact",
      "path": "/tmp/ship-v2/run-0001/chat.md",
      "sha256_after": "a1a1a1a1a1a1a1a1a1a1a1a1a1a1a1a1a1a1a1a1a1a1a1a1a1a1a1a1a1a1a1a1",
      "sha256_before": null
    }
  ],
  "wrote_nothing": true
}
