{
  "interface_version": 1,
  "invocation": {
    "caller": "user",
    "harness": "claude-code",
    "mode": "direct",
    "session_id": "session-0001"
  },
  "plugin_version": "0.1.1",
  "reason": "the extra lap is exhausted without ALL CLEAR (stop condition 1)",
  "report_only": false,
  "run_dir": "/tmp/ship-v2/run-0001",
  "run_id": "run-0001",
  "station": "ship-v2",
  "station_result": {
    "build": "COMPLETE",
    "card": "signed off with conditions",
    "chat": "SHIP: A \u2014 docs/plans/2026-09-20-widget.md\nHook: armed\nResult: STOPPED (condition 1: the extra lap is exhausted without ALL CLEAR)\nBuild: COMPLETE  \u00b7  Signoff: signed off with conditions  \u00b7  Recheck: NOT CLEAR  \u00b7  Card: signed off with conditions  \u00b7  Laps: 2\n\nBottom line: Slice A went through the loop. Read the block for what is next.\n\nRemains: the widget skips a turn \u00b7 MAJOR \u00b7 fix it and run /recheck-v2 A docs/plans/2026-09-20-widget.md\n",
    "condition": 1,
    "doc": "docs/plans/2026-09-20-widget.md",
    "events": [],
    "fixed": [],
    "hook": {
      "armed": true,
      "evidence": "session.jsonl line 41 (a system record)",
      "harness": "claude-code",
      "how": "a record of this session's own transcript shows the Stop hook's confirmation",
      "label": "armed"
    },
    "laps": {
      "allowed": 2,
      "opened": [
        {
          "lap": 1,
          "owner_words": null
        },
        {
          "lap": 2,
          "owner_words": null
        }
      ],
      "owner_words": null,
      "taken": 2
    },
    "pauses": [],
    "recheck": "NOT CLEAR",
    "remains": [
      {
        "finding": "the widget skips a turn",
        "id": "f1:0123456789abcdef0123",
        "needed": "fix it and run /recheck-v2 A docs/plans/2026-09-20-widget.md",
        "severity": "MAJOR",
        "slice": "A"
      }
    ],
    "result_line": "STOPPED (condition 1: the extra lap is exhausted without ALL CLEAR)",
    "signoff": "signed off with conditions",
    "slice": "A",
    "visits": [
      {
        "lap": 0,
        "run_dir": "/tmp/ship-v2/run-0001/visits/0-build-v2",
        "station": "build-v2",
        "status": "completed",
        "word": "COMPLETE"
      },
      {
        "lap": 0,
        "run_dir": "/tmp/ship-v2/run-0001/visits/2-signoff-v2",
        "station": "signoff-v2",
        "status": "completed",
        "word": "signed off"
      }
    ]
  },
  "status": "stopped",
  "stop_tag": "extra-lap-exhausted",
  "trace": {
    "lines": 4,
    "path": "/tmp/ship-v2/run-0001/trace.jsonl",
    "refused": 0,
    "visits": 2
  },
  "writes": [
    {
      "kind": "run_artifact",
      "path": "/tmp/ship-v2/run-0001/ship.json",
      "sha256_after": "3f3f3f3f3f3f3f3f3f3f3f3f3f3f3f3f3f3f3f3f3f3f3f3f3f3f3f3f3f3f3f3f",
      "sha256_before": null
    },
    {
      "kind": "run_artifact",
      "path": "/tmp/ship-v2/run-0001/chat.md",
      "sha256_after": "a1a1a1a1a1a1a1a1a1a1a1a1a1a1a1a1a1a1a1a1a1a1a1a1a1a1a1a1a1a1a1a1",
      "sha256_before": null
    }
  ],
  "wrote_nothing": true
}
