{
  "interface_version": 1,
  "invocation": {
    "caller": "user",
    "harness": "claude-code",
    "mode": "direct",
    "session_id": "session-0001"
  },
  "plugin_version": "0.1.2",
  "reason": "the build doc docs/plans/2026-09-20-widget.md is at neither the bytes this run read nor the bytes its write produces: the doc was edited after this run planned its write. On disk, slice A's line reads `Status: signed off with conditions`. This run's events landed in the records log (seq 7 waived, seq 8 card_set) and are reported as landed; the doc is left as it is, neither written by this run nor reverted",
  "report_only": false,
  "run_dir": "/tmp/ship-v2/run-0001",
  "run_id": "run-0001",
  "station": "ship-v2",
  "station_result": {
    "build": "COMPLETE",
    "card": "signed off",
    "chat": "SHIP: A \u2014 docs/plans/2026-09-20-widget.md\nHook: armed\nResult: STOPPED (outside-edit: outside-edit)\nBuild: COMPLETE  \u00b7  Signoff: signed off  \u00b7  Recheck: not reached  \u00b7  Card: signed off  \u00b7  Laps: 0\n\nBottom line: Slice A went through the loop. Read the block for what is next.\n",
    "condition": null,
    "doc": "docs/plans/2026-09-20-widget.md",
    "events": [
      {
        "appended": true,
        "card": {
          "after": "signed off",
          "before": "signed off with conditions",
          "line": 14,
          "slice": "A"
        },
        "finding": "f1:0123456789abcdef0123",
        "kind": "waived",
        "words": "Waive it, a bench quirk"
      }
    ],
    "fixed": [],
    "hook": {
      "armed": true,
      "evidence": "session.jsonl line 41 (a system record)",
      "harness": "claude-code",
      "how": "a record of this session's own transcript shows the Stop hook's confirmation",
      "label": "armed"
    },
    "laps": {
      "allowed": 2,
      "opened": [],
      "owner_words": null,
      "taken": 0
    },
    "pauses": [
      {
        "answered": true,
        "pause": 1,
        "question": "Only you can rule the MAJOR at src/widget.py:2: waive it or hold?",
        "source": "ship",
        "station": null,
        "words": "Waive it, a bench quirk"
      }
    ],
    "recheck": "not reached",
    "remains": [],
    "result_line": "STOPPED (outside-edit: outside-edit)",
    "signoff": "signed off",
    "slice": "A",
    "visits": [
      {
        "lap": 0,
        "run_dir": "/tmp/ship-v2/run-0001/visits/0-build-v2",
        "station": "build-v2",
        "status": "completed",
        "word": "COMPLETE"
      },
      {
        "lap": 0,
        "run_dir": "/tmp/ship-v2/run-0001/visits/2-signoff-v2",
        "station": "signoff-v2",
        "status": "completed",
        "word": "signed off"
      }
    ]
  },
  "status": "stopped",
  "stop_tag": "outside-edit",
  "trace": {
    "lines": 4,
    "path": "/tmp/ship-v2/run-0001/trace.jsonl",
    "refused": 0,
    "visits": 2
  },
  "writes": [
    {
      "kind": "run_artifact",
      "path": "/tmp/ship-v2/run-0001/ship.json",
      "sha256_after": "3f3f3f3f3f3f3f3f3f3f3f3f3f3f3f3f3f3f3f3f3f3f3f3f3f3f3f3f3f3f3f3f",
      "sha256_before": null
    },
    {
      "kind": "run_artifact",
      "path": "/tmp/ship-v2/run-0001/chat.md",
      "sha256_after": "a1a1a1a1a1a1a1a1a1a1a1a1a1a1a1a1a1a1a1a1a1a1a1a1a1a1a1a1a1a1a1a1",
      "sha256_before": null
    },
    {
      "kind": "records_log",
      "path": "/tmp/widget-workspace/docs/records/docs__plans__2026-09-20-widget.events.jsonl",
      "sha256_after": "a1a1a1a1a1a1a1a1a1a1a1a1a1a1a1a1a1a1a1a1a1a1a1a1a1a1a1a1a1a1a1a1",
      "sha256_before": "3f3f3f3f3f3f3f3f3f3f3f3f3f3f3f3f3f3f3f3f3f3f3f3f3f3f3f3f3f3f3f3f"
    }
  ],
  "wrote_nothing": false
}
